document,paragraph_index,original_text,simplified_text,original_text_isssues_detected,simplification_rules_applied,tagging_date,tagging_elapsed_time
aae5c6f0c213946d265cb98c08106c0b,41,"I responsabili del Reparto Operativo, sentiti periodicamente gli operatori del servizio, registrano le anomalie che presentano i procedimenti, formulano le proposte di miglioramento degli stessi e le trasmettono al Comandante della Polizia Locale di Rovigo, Responsabile della Qualità di settore, affinché le includa nel Rapporto qualità e vengano considerate nella redazione del relativo Piano di miglioramento.","I responsabili del Reparto Operativo, sentiti periodicamente gli operatori del servizio, registrano le anomalie nei procedimenti. Formulano le proposte di miglioramento degli stessi e le trasmettono al Comandante della Polizia Locale di Rovigo, Responsabile della Qualità di settore. Il Comandante della Polizia Locale di Rovigo le include nel Rapporto qualità, perché vengano considerate nella redazione del relativo Piano di miglioramento.",,,2024-03-27T12:22:23.059504,98.0
aae5c6f0c213946d265cb98c08106c0b,42,I procedimenti amministrativi oggetto dei Servizi di Polizia Locale Reparto Operativo sono indicati nel prospetto di seguito riportato. ,I procedimenti amministrativi oggetto dei Servizi di Polizia Locale Reparto Operativo sono indicati nel prospetto di seguito riportato. ,,,2024-03-27T12:22:37.712521,13.0
aae5c6f0c213946d265cb98c08106c0b,43,"Per ognuno di essi sono indicati: 
- il nome del responsabile del procedimento; 
- il nome del responsabile dell'Ufficio (Reparto);
- i nomi degli operatori che, eventualmente, forniscono al responsabile il supporto necessario; 
- i tempi massimi di legge entro i quali deve essere concluso il procedimento;","Per ognuno di essi sono indicati: 
- il nome del responsabile del procedimento; 
- il nome del responsabile dell'Ufficio (Reparto);
- i nomi degli operatori che, eventualmente, forniscono al responsabile il supporto necessario; 
- i tempi massimi di legge entro i quali deve essere concluso il procedimento;",,,2024-03-27T12:23:16.340774,36.0
aae5c6f0c213946d265cb98c08106c0b,44,"Qualora l'utente non provveda a inviare la documentazione completa o la trasmetta inesatta, rallentando in tal modo il procedimento, i responsabili del Reparto Operativo si impegnano a sollecitarlo informandolo sullo stato della pratica al fine di trovare una rapida soluzione. A questo proposito, gli stessi si impegnano, in casi di particolare complessità, a convocarlo, anche telefonicamente, per una più rapida risoluzione di eventuali problemi.","Se l'utente non invia la documentazione completa o la trasmetta inesatta, e così rallenta il procedimento, i responsabili del Reparto Operativo lo sollecitano. Lo informano inoltre sullo stato della pratica per trovare una rapida soluzione. I responsabili si impegnano, in casi di particolare complessità, a chiamarlo, anche telefonicamente, per una più rapida risoluzione di eventuali problemi.",,,2024-03-27T12:25:15.522024,115.0
aae5c6f0c213946d265cb98c08106c0b,45,Disponibilità agli appuntamenti extra orario di apertura al pubblico,Disponibilità agli appuntamenti extra orario di apertura al pubblico,,,2024-03-27T12:25:21.627684,5.0
aae5c6f0c213946d265cb98c08106c0b,46,Uniformità degli orari al pubblico del Servizio polizia locale con gli orari di altri uffici pubblici potenzialmente coinvolti nei vari procedimenti,Uniformità degli orari al pubblico del Servizio polizia locale con gli orari di altri uffici pubblici potenzialmente coinvolti nei vari procedimenti,,,2024-03-27T12:25:30.067332,7.0
aae5c6f0c213946d265cb98c08106c0b,47,Tempi medi di ricerca per visura/rilascio copia di atti su domanda,Tempi medi di ricerca per visura/rilascio copia di atti su domanda,,,2024-03-27T12:25:34.191864,3.0
aae5c6f0c213946d265cb98c08106c0b,48,"Uniformità e compatibilità sistema informatico ed informativo con gli uffici coinvolti in una pratica complessa (servizi sociali lavori pubblici, ambiente ragioneria, LL.PP., contratti)","Uniformità e compatibilità sistema informatico ed informativo con gli uffici coinvolti in una pratica complessa (servizi sociali lavori pubblici, ambiente ragioneria, LL.PP., contratti)",,,2024-03-27T12:25:41.628749,6.0
aae5c6f0c213946d265cb98c08106c0b,49,Identificabilità del personale mediante placca negli orari di servizio,Identificabilità del personale mediante placca negli orari di servizio,,,2024-03-27T12:25:45.751888,3.0
aae5c6f0c213946d265cb98c08106c0b,50,"Corsi di aggiornamento tecnico, addestramento teorico/pratico, formazione sulla persona","Corsi di aggiornamento tecnico, addestramento teorico/pratico, formazione sulla persona",,,2024-03-27T12:25:50.799516,4.0
aae5c6f0c213946d265cb98c08106c0b,51,Indagini sulla soddisfazione degli utenti del servizio,Indagini sulla soddisfazione degli utenti del servizio,,,2024-03-27T12:25:55.117214,3.0
aae5c6f0c213946d265cb98c08106c0b,52,N° reclami presentati a carico dei servizi di Polizia locale Reparto Operativo nell'arco dell'anno solare,N° reclami presentati a carico dei servizi di Polizia locale Reparto Operativo nell'arco dell'anno solare,,,2024-03-27T12:25:59.034221,3.0
aae5c6f0c213946d265cb98c08106c0b,53,"Annualmente i responsabili del Reparto Operativo producono al Comandante della Polizia Locale di Rovigo un Rapporto di valutazione sulla Carta del Servizio con indicazione: 
- dei risultati dell'attività relativamente agli indicatori di qualità riportati in tabella, con i relativi scostamenti dagli standard prestabiliti, esplicandone le cause e proponendo i relativi correttivi sull'attività del reparto; 
- degli esiti delle indagini di soddisfazione effettuate sugli utenti; 
- dei reclami, presentati direttamente o indirettamente, dagli utenti; 
- delle eventuali anomalie riscontrate.","Ogni anno i responsabili del Reparto Operativo danno al Comandante della Polizia Locale di Rovigo un Rapporto di valutazione sulla Carta del Servizio con indicazione: 
- dei risultati dell'attività che riguarda gli indicatori di qualità riportati in tabella. Vengono anche inseriti i relativi scostamenti dagli standard prestabiliti, sono chiarite le cause e sono propeste dei miglioramenti sull'attività del reparto; 
- degli esiti delle indagini di soddisfazione effettuate sugli utenti; 
- dei reclami, presentati direttamente o indirettamente, dagli utenti; 
- delle eventuali anomalie individuate.",,,2024-03-27T12:27:54.001990,110.0
aae5c6f0c213946d265cb98c08106c0b,54,"Il rapporto è esaminato in pubbliche adunanze, alle quali sono invitati direttamente i rappresentanti delle Associazioni per la tutela dei Consumatori, con le quali esiste un apposito Protocollo d'Intesa. ","Il rapporto è esaminato in riunioni pubbliche, a queste sono invitati direttamente i rappresentanti delle Associazioni per la tutela dei Consumatori. Esiste un apposito Protocollo d'Intesa con i rappresentanti delle Associazioni per la tutela dei Consumatori.",,,2024-03-27T12:32:29.243717,90.0
aae5c6f0c213946d265cb98c08106c0b,55,"A seguito degli esiti delle pubbliche adunanze il Comandante della Polizia Locale di Rovigo, d'accordo con i responsabili del Reparto Operativo aggiorna o conferma gli standard e gli indicatori di qualità rinvenibili nella presente Carta del Servizio, su corrispondente Direttiva del Sindaco o dell'Assessore alla Sicurezza.","Dopo le riunioni pubbliche il Comandante della Polizia Locale di Rovigo, d'accordo con i responsabili del Reparto Operativo aggiorna o conferma gli indicatori di qualità che si trovano in questa Carta del Servizio. Per queste attività è necessaria una Direttiva del Sindaco o dell'Assessore alla Sicurezza.",,,2024-03-27T12:34:48.074924,134.0
