document,paragraph_index,original_text,simplified_text,original_text_isssues_detected,simplification_rules_applied,tagging_date,tagging_elapsed_time
aae5c6f0c213946d265cb98c08106c0b,1,"L'obiettivo primario del Servizio è la diffusione e il rispetto delle norme che regolano la convivenza civile sul territorio comunale. In particolare il servizio svolto si propone alla cittadinanza per meglio far conoscere i servizi offerti e per un migliore orientamento nel territorio (informazione su dislocazione di servizi di pubblica utilità, parcheggi, toponomastica vie, ecc.).","Il Servizio fa conoscere le leggi e come rispettarle per migliorare la vita sul territorio comunale. In particolare il servizio intende far conoscere meglio ai cittadini i servizi offerti per aiutarli a orientarsi nel territorio (informazione su dove si trovano i servizi di pubblica utilità, i parcheggi, le vie, ecc.).",Molte perifrasi | molti nomi d'azione | primo capoverso oscuro ,Eliminate perifrasi | eliminate nominalizzazioni sostituite con verbi | costituite parole più rare con parole di uso molto comune,2024-03-11T18:41:21.341353,189.0
aae5c6f0c213946d265cb98c08106c0b,2,"I Servizi di Polizia Locale Reparto Operativo del Comune svolgono la propria attività a favore del rispetto delle regole di convivenza nella città di Rovigo, basandosi su alcuni principi fondamentali, enunciati di seguito al punto 9) ed attuati sempre con spirito di servizio. ",La Polizia Locale (reparto operativo) fa rispettare le regole di vita comune nella città di Rovigo. La Polizia agisce con spirito di servizio ai cittadini e segue i principi indicati nell'elenco al punto 9.,Frase lunga | inutili perifrasi,Abbreviare testo | evitare perifrasi | spezzare frase lunga,2024-03-11T18:43:43.900078,142.0
aae5c6f0c213946d265cb98c08106c0b,3,"L'operatore di Polizia Locale, quindi, rappresenta un importante punto di riferimento per la collettività. Nell'ambito delle sue funzioni, esso svolge i propri compiti in maniera autorevole, dando prova di preparazione professionale e sensibilità nel contatto relazionale. La sua attività, inoltre, è caratterizzata dal costante sforzo teso alla migliore interpretazione delle situazioni e delle problematiche incontrate, applicando un approccio educativo e orientato alla più adeguata risposta ai bisogni della cittadinanza. ","La Polizia Locale è un punto di riferimento per i cittadini. La Polizia Locale ha autorevolezza, professionalità e sensibilità nel contatto con i cittadini. La Polizia Locale cerca sempre di interpretare al meglio situazioni e problematiche incontrate. La Polizia Locale si comporta in modo da educare e rispondere adeguatamente ai bisogni dei cittadini. ",Spezzare frasi lunghe | evitare astratti e nomi d'azione | ripetere il soggetto,Nomi collettivi astratti sostituiti con nomi concreti | ripetere il soggetto,2024-03-11T18:46:43.829728,179.0
aae5c6f0c213946d265cb98c08106c0b,4,"Le modalità di azione e di intervento partono dall'ascolto dei bisogni del cittadino, al fine di individuare soluzioni adeguate e orientate al benessere comune, per una migliore fruizione dei servizi e delle possibilità d'uso della città.",La Polizia Locale agisce e interviene dopo aver ascoltato i bisogni del cittadino e cerca soluzioni adeguate e orientate al benessere comune. Essa aiuta i cittadini a utilizzare al meglio i servizi  offerti nella città.,Perifrasi | lunghezze | frasi subordinate implicite,Abbreviare | Indicare sempre il soggetto esplicitandolo | Evitare subordinate implicite | evitare locuzioni congiuntive,2024-03-11T18:49:11.635122,147.0
aae5c6f0c213946d265cb98c08106c0b,5,"Il Servizio di Polizia Locale Reparto Operativo agisce al fine di garantire l'ordinato svolgimento delle seguenti attività: controllo della mobilità e sicurezza stradale; tutela della vivibilità e della qualità urbana, nonché salvaguardia della sicurezza sociale.","La Polizia Locale (Reparto Operativo) si occupa delle seguenti attività: controlla la mobilità (strade, auto) e la sicurezza delle strade; tutela una buona qualità della vita in città e la sicurezza sociale.", ,Eliminato il concetto di Servizio rimandando tutto alla Polizia Locale soggetto esplicito | sostituire nomi d'azione con verbi | Uso di parole comuni,2024-03-11T18:52:35.124995,202.0
aae5c6f0c213946d265cb98c08106c0b,6,"attività di controllo esercitata sugli utenti della strada, volta a prevenire e reprimere i comportamenti che creano pericolo per la sicurezza e l'incolumità dei cittadini sulle strade, o che ledono il diritto alla mobilità; ","attività di controllo in strada per evitare o contrastare i comportamenti che mettono in pericolo i cittadini sulle strade, o che riducono il diritto dei cittadini di muoversi liberamente; ",,Evitare perifrasi ridondanti | sostituzione di verbi colti con verbi di uso comune | sostituzione di nomi astratti con verbi,2024-03-12T08:06:07.862939,182.0
aae5c6f0c213946d265cb98c08106c0b,7,azioni di regolamentazione e sostegno finalizzate ad un più fluido scorrimento della viabilità locale.,attività che servono a regolare il traffico in modo che le auto esso sia più scorrevole.,si tratta di paragrafi collegati a un paragrafo precedente che elenca i compiti della Polizia locale,"mantenere lo stesso termine, attività, in un elenco per far capire che si tratta di un elenco di cose messe sullo stesso piano | evitare nomi d'azione sostituiti da verbi | evitare nomi astratti come viabilità sostituito dal concetto di auto (parola comune colloquiale) e scorrevolezza",2024-03-12T08:09:01.968583,173.0
aae5c6f0c213946d265cb98c08106c0b,8,"Le priorità di intervento sono sviluppate attraverso azioni mirate a far rispettare il Codice della Strada (eccesso di velocità, transito con il semaforo rosso, rispetto dell'uso del casco, divieto di uso del telefono cellulare nei casi previsti, obbligo di cinture di sicurezza, ecc.), in accordo con le strategie dell'Amministrazione Comunale, e rifacendosi inoltre alle analisi dei fenomeni propri della mobilità locale ed ai dati relativi alle componenti di rischio per gli utenti della strada. Tali campagne vengono promosse e supportate da azioni di informazione continua: l'educazione stradale scolastica ne rappresenta un momento fondamentale, incidendo sulla formazione delle fasce giovanili della popolazione.","La Polizia Locale svolge le attività e stabilisce quelle che hanno precedenza su altre. In particolare fa rispettare le regole di base del Codice della Strada (non superare i limiti di velocità, non passare con il semaforo rosso, usare il casco, non usare il telefono cellulare mentre si guida, allacciare le cinture di sicurezza, ecc.) e per questo si collega: alle indicazioni del Comune, allo studio delle abitudini locali e ai dati conosciuti su quali sono i rischi maggiori per le persone in strada. La Polizia Locale fa campagne di informazione come: l'educazione stradale a scuola che serve a educare i giovani.",Frasi lunghe | molti nomi d'azione,Inserire il soggetto | sostituire nomi d'azione con verbi | sostituire parole colte con parole comuni | abbreviare perifrasi lunghe | inserire i due punti prima di un breve elenco,2024-03-12T08:15:54.342031,411.0
aae5c6f0c213946d265cb98c08106c0b,9,"Comprende le attività operative specifiche per la promozione di un sistema integrato di sicurezza in base alle direttive impartite dalla Prefettura. In tal senso la Polizia Locale opera d'iniziativa ed anche in collaborazione con altre forze di Polizia, con altri settori della Amministrazione Comunale e con le istituzioni locali preposte alle problematiche sociali che possono incidere sul territorio in termini di sicurezza e vivibilità. Le specifiche azioni intraprese sono finalizzate a monitorare e contrastare la microcriminalità e fenomeni di disagio urbano, quali ad esempio lo spaccio di sostanze stupefacenti, gli edifici occupati abusivamente, e così via. La Polizia Locale si impegna inoltre, con tutte le risorse presenti sul territorio e attraverso gli agenti di quartiere, a prevenire e controllare fenomeni di disturbo della quiete pubblica, nonché ad intervenire in situazioni di conflitto o che comportino problemi alla convivenza dei cittadini.","La Polizia Locale svolge anche altre attività per aumentare la sicurezza a livello locale secondo le indicazioni della Prefettura. La Polizia Locale svolge attività anche insieme a altre forze di Polizia, a altri uffici del Comune, a uffici di altre istituzioni locali che sul territorio si occupano di far vivere bene e sicuri i cittadini. La Polizia locale controlla e combatte i piccoli  criminali e reati come lo spaccio di sostanze stupefacenti, l'occupazione abusiva di palazzi, e altri. La Polizia Locale con i suoi agenti presenti sul territorio e attraverso gli agenti di quartiere cerca di evitare e controllare chi disturba la quiete pubblica, chi litiga e in generale tutto ciò che rende meno serena la vita dei cittadini.",,"Ripetere sempre il soggetto e quindi riferire tutto alla Polizia | mantenere negli elenchi lo stesso punto di vista (controlla lo spaccio e l'occupazione non lo spaccio e gli edifici) | umanizzare sempre gli enti (agenti, persone) | evitare verbi colti | rendere colloquiale l'espressione",2024-03-12T08:24:04.453751,489.0
aae5c6f0c213946d265cb98c08106c0b,10,"Cittadini residenti e non residenti che usufruiscono dei servizi della Polizia Locale, con le modalità illustrate al punto precedente.",La Polizia locale si occupa di cittadini residenti e non residenti in tutti i modi che abbiamo descritto prima.,Non chiaro come questo paragrafo si collega al precedente,Eliminare perifrasi e rendere colloquiale,2024-03-12T08:25:31.745123,86.0
aae5c6f0c213946d265cb98c08106c0b,11,L'Ufficio Cassa è aperto negli stessi giorni dalle ore 08.30 alle ore 12.30.,L'Ufficio Cassa è aperto negli stessi giorni dalle ore 08.30 alle ore 12.30.,Forse manca qualcosa,,2024-03-12T08:25:58.366607,24.0
aae5c6f0c213946d265cb98c08106c0b,12,"Mediante libero accesso agli uffici negli orari di apertura al pubblico si effettuano le seguenti prestazioni: 
- Informazioni generali; 
- Informazioni e chiarimenti relativi ad eventuali preavvisi di contravvenzione; 
- Ritiro e consegna atti","Il cittadino può venire senza appuntamento negli uffici per: 
- chiedere Informazioni generali; 
- chiedere Informazioni e chiarimenti su multe ricevute a casa; 
- ritirare e consegnare documenti",lessico,Sostituzione di parole burocratiche o astratte con espressioni comuni - colloquiali | aggiunta del verbo | multa invece di contravvenzione,2024-03-12T08:27:56.467086,117.0
aae5c6f0c213946d265cb98c08106c0b,13,"È possibile ricevere informazioni mediante appuntamento, che può essere richiesto e fissato anche telefonicamente ai seguenti numeri",Puoi chiedere informazioni venendo da vicino su appuntamento: per l'appuntamento telefonaci a questi numeri,  ,Usare la seconda persona per rivolgersi direttamente al destinatario quando c'è una informazione diretta da indirizzare | anche la seconda frase è riformulata con un verbo all'imperativo seconda persona singolare | Seguenti sostituito con questi,2024-03-12T15:24:30.677278,141.0
aae5c6f0c213946d265cb98c08106c0b,14,"I destinatari del servizio possono esercitare il loro diritto, nell'ambito del processo di erogazione del servizio, a partecipare al miglioramento dei procedimenti in termini di semplificazione, trasparenza, efficienza ed efficacia.","I cittadini hanno diritto di partecipare al miglioramento delle attività realizzate dalla Polizia aumentando la loro semplicità, trasparenza, efficienza e efficacia.",,Evitare perifrasi iniziale | eliminazione dell'inciso,2024-03-12T15:28:29.275872,237.0
aae5c6f0c213946d265cb98c08106c0b,15,"I destinatari del servizio possono esercitare il loro diritto, nell'ambito del processo di erogazione del servizio, a partecipare all'istruttoria del procedimento di interesse, esercitando i diritti.",I cittadini hanno il diritto di partecipare alla fase di lavoro in cui si organizzano procedure su cose di loro interesse.,,Perifrasi | eliminazione inciso | lessico comune invece di lessico più elevato,2024-03-12T15:30:04.510180,94.0
aae5c6f0c213946d265cb98c08106c0b,16,Nell'esercizio di tali diritti l'utente riceve l'assistenza del responsabile del procedimento o dell'istruttore incaricato.,I cittadini che vogliono far valere i loro diritti sono aiutati da chi è responsabile delle azioni / procedure o da chi è incaricato di metterle in atto.,,"Eliminazione perifrasi | sostituzione termine astratto assistenza con verbo aiutare | sostituzione di termini responsabile, procedimento, istruttore con perifrasi più concrete e semplici",2024-03-12T15:32:27.180978,142.0
aae5c6f0c213946d265cb98c08106c0b,17,"L'erogazione del servizio avviene di norma con continuità, regolarità e senza interruzioni nei giorni e negli orari stabiliti al punto 6. ",Il servizio offerto viene svolto continuamente e regolarmente nei giorni e negli orari scritti al punto 6. ,,Sostituzione del nome di azione erogazione | sostituzione di due nomi astratti con avverbi ,2024-03-12T15:35:03.045546,64.0
aae5c6f0c213946d265cb98c08106c0b,18,"Eventuali interruzioni nell'erogazione del servizio, dovute a cause di forza maggiore o eventualmente programmate, saranno tempestivamente comunicate all'utenza, unitamente alla motivazione dell'interruzione, di norma nei seguenti modi: 
- con affissioni di cartelli agli ingressi degli uffici; 
- pubblicate sul sito Internet del Comune nella pagina ""Polizia Locale"", all'interno della ""Guida ai servizi comunali""","In qualche caso il Comune potrà interrompere il servizio, ma solo per cause gravi o motivi già stabiliti. Se succede questo il comune comunica subito la notizia ai cittadini e spiega perché c'è la interruzione del servizio. Il Comune comunica in questi modi: 
- con cartelli attaccati alle porte d'ingresso degli uffici; 
- con avvisi pubblicati sul sito Internet del Comune nella pagina ""Polizia Locale"", cliccando sulla parola ""Guida ai servizi comunali""",,Evitare espressioni impersonali e il passivo (interruzioni saranno comunicate) sostituito dalla forma attiva il comune comunica | Spezzare la frase in due per poter mettere a soggetto esplicito sempre il Comune | Linguaggio molto colloquiale nelle descrizioni dei modi di comunicare del comune con lessico colloquiale,2024-03-12T15:42:11.321759,178.0
aae5c6f0c213946d265cb98c08106c0b,19,"I Servizi di Polizia Locale Reparto Operativo improntano la propria azione organizzativa e di erogazione delle prestazioni ai principi di efficienza ed efficacia, specificando che:
- per efficienza si intende la fornitura di prestazioni e servizi al massimo livello quantitativo e qualitativo rispetto alle risorse a disposizione ed ai programmi stabiliti;
- per efficacia si intende la fornitura di prestazioni e servizi al massimo livello quantitativo e qualitativo rispetto ai bisogni ed alle necessità degli utenti, ricercando la soddisfazione degli stessi","La Polizia Locale (Reparto Operativo) lavora in modo efficiente e efficace:
- per efficiente intendiamo che lavora molto e con alta qualità in base a quante persone ci sono da assistere e ai programmi stabiliti;
- per efficace intendiamo che lavora molto e con alta qualità rispetto ai bisogni ed alle necessità dei cittadini cercando di accontentarli ",,Personalizzare usando il soggetto ricorrente Polizia Locale | evitare perifrasi formali e sostituire con verbi colloquiali | personalizzare con verbo alla prima persona al posto della forma impersonale con si,2024-03-12T16:15:34.846873,140.0
aae5c6f0c213946d265cb98c08106c0b,20,"Gli operatori dei Servizi di Polizia Locale Reparto Operativo ispirano i loro comportamenti nei confronti degli utenti a criteri di obiettività, giustizia ed imparzialità.","I poliziotti della Polizia Locale (Reparto Operativo) si rivolgono ai cittadini in modo ragionevole, secondo giustizia e senza fare preferenze.",,Ridurre la perifrasi e personalizzare la frase mettendo a soggetto il solito nome Polizia Locale | Evitare perifrasi inutilmente lunghe,2024-03-12T16:24:42.229658,5.0
aae5c6f0c213946d265cb98c08106c0b,21,"I responsabili del Reparto Operativo si impegnano a far sì che il comportamento dei propri collaboratori sia ispirato a presupposti di gentilezza, cortesia e disponibilità nei rapporti con gli utenti, auspicando che l'atteggiamento di questi ultimi sia improntato ad un criterio di proficua collaborazione, tale da agevolare in ogni occasione la corretta erogazione del servizio. ","I responsabili del Reparto Operativo dicono ai collaboratori di essere gentili, cortesi e disponibili verso i cittadini. Anche i cittadini devono cercare di collaborare e di agevolare in ogni occasione il lavoro della Polizia Locale. ",,Ridurre perifrasi a vantaggio di un'espressione diretta | aggettivi invece dei nomi astratti di qualità | separazione in due frasi | anche la seconda frase ha come soggetto un'entità animata e non l'atteggiamento,2024-03-12T16:28:42.625580,83.0
aae5c6f0c213946d265cb98c08106c0b,22,I responsabili del Reparto Operativo si impegnano inoltre a favorire l'applicazione di tali elementi relazionali nei confronti degli utenti anche attraverso opportune e specifiche azioni formative dirette agli operatori di ogni ordine e grado.,I responsabili del Reparto Operativo educano a questo modo di agire verso i cittadini anche tutti gli operatori di ogni ordine e grado. Insegnano questo atteggiamento in corsi creati per questo scopo.,,Evitare perifrasi inutili | spiegare i concetti in modo colloquiale,2024-03-12T16:30:54.695408,74.0
aae5c6f0c213946d265cb98c08106c0b,23,"Gli operatori del servizio si impegnano, nei rapporti con gli utenti, ad utilizzare in ogni occasione di comunicazione, sia verbale che scritta, un linguaggio semplificato e comprensibile ai destinatari, ponendo particolare cura alla spiegazione dei termini tecnico/giuridici. ",I poliziotti e tutti quelli che lavorano per la Polizia Locale utilizzano sempre - quando parlano o quando scrivono - una lingua semplice e comprensibile; in particolare spiegano ai cittadini le parole tecnico/giuridiche. ,,Personalizzare evitando perifrasi inutili | sostituire termini tecnici come comunicazione verbale i verbi parlare e scrivere | Abbreviare,2024-03-12T16:33:07.099250,85.0
aae5c6f0c213946d265cb98c08106c0b,24,"Gli stessi operatori, in orario di servizio, garantiscono all'utenza la loro agevole identificabilità attraverso l'esposizione di una placca indicante con caratteri ben leggibili il loro rispettivo numero di matricola.",I poliziotti quando lavorano devono indossare una medaglietta che contiene il loro numero di matricola. I cittadini devono poter leggere facilmente la medaglietta in modo da sapere con chi stanno parlando.,,Sostituire tutti i termini astratti con espressioni concrete e della lingua comune | Riorganizzata la frase in modo da avere 2 frasi ciascuna con un soggetto espresso e identificato bene,2024-03-12T16:36:35.199867,118.0
aae5c6f0c213946d265cb98c08106c0b,25,"Allo scopo di favorire il rapido decorso delle pratiche che presuppongono l'intervento di più reparti, appartenenti anche a Settori diversi, i Servizi di Polizia Locale Reparto Operativo promuovono la costituzione di un Tavolo di Coordinamento intersettoriale, con riunioni periodiche e programmate, allo scopo di costituire un dispositivo destinato a meglio coordinare l'attività tra uffici, in linea con quanto affermato al punto 9.c.","La Polizia Locale chiama a riunione (Tavolo di Coordinamento) altri reparti, settori diversi, per fare in modo che le richieste dei cittadini che interessano più settori siano svolte rapidamente. Queste riunioni tra settori diversi si svolgono a intervalli di tempo regolari per fare in modo che gli uffici siano sempre collegati tra loro (come stabilito al punto 9.c. vedi più avanti).",,"Abbreviato molto il testo, eliminando perifrasi ma soprattutto rimettendo in ordine la frase con soggetto a inizio frase, verbo colloquiale, e poi i complementi",2024-03-12T16:40:25.807017,172.0
aae5c6f0c213946d265cb98c08106c0b,26,I Servizi di Polizia Locale Reparto Operativo adottano gli strumenti utili ad assicurare la piena informazione degli utenti circa le modalità di prestazione dei servizi.,La Polizia Locale (Reparto Operativo) assicura l'informazione ai cittadini su come vengono svolte le attività lavorative.,,"Soggetto esplicito e umanizzato, ripete quello adottato sin qui nella riscrittura | verbi al posto di nomi d'azione | perifrasi accorciate",2024-03-12T18:15:45.877876,41.0
aae5c6f0c213946d265cb98c08106c0b,27,"forniscono, tramite gli operatori, tutte le informazioni verbali per il soddisfacimento delle richieste degli utenti; ",i lavoratori della Polizia locale rispondono anche a voce di persona a tutte le richieste dei cittadini; ,,Cambiato ordine delle parole per esprimere il concetto in modo lineare e colloquiale | Eliminato nome di azione,2024-03-12T18:17:56.391740,93.0
aae5c6f0c213946d265cb98c08106c0b,28,"garantiscono, per ogni procedimento elencato più avanti al punto 11 della presente Carta di Servizio, che gli atti notificati agli utenti contengono le necessarie indicazioni per l'inoltro di eventuali ricorsi. In tale prospettiva, garantiscono altresì che ogni riferimento di legge sarà seguito dalla riproduzione dello stralcio della norma pertinente ovvero dal suo Titolo, allo scopo di ottenere il massimo di chiarezza e comprensibilità; ","La Polizia fa in modo che quando si manda una comunicazione ufficiale a un cittadino questa contenga anche tutte le informazioni per presentare un ricorso, cioè una richiesta per opporsi alla comunicazione della Polizia. In particolare il cittadino può fare ricorso per le richieste elencate al punto 11 della Carta di Servizio che stai leggendo. Per aiutare il cittadino a opporsi eventualmente alle richieste della Polizia, la comunicazione ufficiale deve contenere il testo di legge in base al quale viene chiamato dalla Polizia oppure deve contenere il Titolo della legge: questo per fare in modo di comunicare in modo chiaro e comprensibile. ",,Soggetto esplicito | evitare incisi e rendere lineare la frase | sostituire parole formali con parole colloquiali,2024-03-12T18:24:52.099376,310.0
aae5c6f0c213946d265cb98c08106c0b,29,"forniscono informazioni agli utenti sui loro diritti di partecipazione, accesso e trasparenza sulla situazione di una pratica, in particolare comunicando esplicitamente e tempestivamente agli interessati: 
- il nominativo del responsabile del procedimento e dell'operatore che materialmente segue la pratica; 
- il termine previsto dalla legge per la chiusura del procedimento;","La Polizia Locale informa i cittadini sui loro diritti: cioè partecipare, poter leggere documenti che lo riguardano, avere notizie trasparenti sulla situazione di una pratica. In particolare la Polizia comunica in modo esplicito e rapido ai cittadini interessati:
- il nome della persona responsabile per legge della pratica  e della persona che concretamente segue la pratica; 
- il giorno in cui si chiude la pratica;",,Soggetto esplicito | verbi invece di nomi d'azione | termini colloquiali invece di più formali,2024-03-12T18:36:47.761598,191.0
aae5c6f0c213946d265cb98c08106c0b,30,"informano tempestivamente gli utenti della eventuale interruzione dell'erogazione del servizio, con le modalità di cui al punto 9.b; ",La Polizia Locale informa velocemente i cittadini se viene interrotto il servizio usando gli stessi metodi elencati al punto 9.b; ,,Soggetto esplicito | verbi al posto di nomi d'azione,2024-03-12T18:38:13.972614,85.0
aae5c6f0c213946d265cb98c08106c0b,31,"indicano esplicitamente, in ogni atto di rifiuto o dissenso, l'Autorità alla quale l'utente può presentare ricorso ed i termini entro cui poterlo fare.","Se la Polizia non accetta una richiesta dei cittadini o se c'è un'idea diversa tra cittadino e Polizia, la Polizia deve dire al cittadino in modo chiaro a quale Autorità il cittadino si può rivolgere per opporsi alla decisione e quanti giorni di tempo ha per opporsi.",,Soggetto esplicito | termini colloquiali | verbi al posto di nomi d'azione,2024-03-12T18:55:33.389181,112.0
aae5c6f0c213946d265cb98c08106c0b,32,"I responsabili del Reparto Operativo, d'intesa con il Comandante della Polizia Locale di Rovigo ed in accordo con il Settore Risorse Umane, predispone tutte le necessarie azioni formative nei confronti del personale operativo del servizio, affinché i rapporti dello stesso con gli utenti siano sempre improntati al massimo rispetto, cortesia e competenza professionale ed il loro atteggiamento sia tale da agevolare gli stessi nell'esercizio dei diritti e nell'adempimento degli obblighi. ","I responsabili della Polizia Locale (Reparto Operativo) insieme al Comandante della Polizia Locale di Rovigo e all'ufficio Risorse Umane formano i poliziotti in modo che loro trattino i cittadini con rispetto, con cortesia e con capacità professionale. I poliziotti imparano a aiutare i cittadini a difendere i propri diritti ma anche a fare i loro doveri. ",,Soggetto coerente col precedente testo | eliminazione di perifrasi inutili | lessico colloquiale,2024-03-12T19:01:58.143092,121.0
